<?xml version="1.0" encoding="UTF-8"?>
<xs:schema xmlns:xs="http://www.w3.org/2001/XMLSchema" elementFormDefault="qualified">
  <xs:element name="characters">
    <xs:complexType>
      <xs:sequence>
        <xs:element maxOccurs="unbounded" ref="character"/>
      </xs:sequence>
    </xs:complexType>
  </xs:element>
  <xs:element name="character">
    <xs:complexType>
      <xs:sequence>
        <xs:element ref="name"/>
        <xs:element ref="titles"/>
      </xs:sequence>
    </xs:complexType>
  </xs:element>
  <xs:element name="name" type="xs:string"/>
  <xs:element name="titles">
    <xs:complexType>
      <xs:sequence>
        <xs:element maxOccurs="unbounded" ref="title"/>
      </xs:sequence>
    </xs:complexType>
  </xs:element>
  <xs:element name="title" type="xs:string"/>
</xs:schema>
